MCQ,Choices,Correct
What is biology?,a: The study of rocks | b: The study of life | c: The study of stars | d: The study of computers,b
Which theme explains the unity and diversity of life?,a: Evolution | b: Energy processing | c: Cell structure | d: Genetic encoding,a
"What allows organisms to move, grow, and reproduce?",a: Photosynthesis | b: Energy processing | c: Cell division | d: DNA replication,b
What is a major component of all organisms?,a: Mitochondria | b: Chloroplast | c: Cell membrane | d: Cell,d
When did life on Earth emerge?,a: 500 million years ago | b: 1 billion years ago | c: 3.7 billion years ago | d: 5 billion years ago,c
